index,Newspaper,Date,Reviewer,Title,Theatre,Review,Lat,Long,Spectator_Cat,Audience_Cat,Show_Cat,Story_Cat,Decor_Cat,Theatre_Cat,Production_Cat,Character_Cat,End_Cat,Beginning_Cat,Max_Value,Cluster,Neg,Neu,Pos,Compound,Polarity,Subjectivity,Angry,Fear,Happy,Sad,Surpise,Top_10_Keywords,Start_Review_1,End_Review_1,Start_Review_2,End_Review_2,Start_Review_3,End_Review_3,Nbr_of_Sentences,Length_Start_Count_Words_1,Length_End_Count_Words_1,Length_Start_Count_Words_2,Length_End_Count_Words_2,Length_Start_Count_Words_3,Length_End_Count_Words_3,Question_Mark_Start_1,Question_Mark_End_1,Question_Mark_Start_2,Question_Mark_End_2,Question_Mark_Start_3,Question_Mark_End_3,Exclamation_Mark_Start_1,Exclamation_Mark_End_1,Exclamation_Mark_Start_2,Exclamation_Mark_End_2,Exclamation_Mark_Start_3,Exclamation_Mark_End_3,Word_Average_Start_1,Word_Average_End_1,Word_Average_Start_2,Word_Average_End_2,Word_Average_Start_3,Word_Average_End_3,First_Name_Reviewer,Gender_First_Name_Reviewer,Review_Clean,Cluster_LDA,Cluster_LDA_Calculation
5,OBSERVER,10.1.10,Susannah Clapp ,THE LADY OR THE TIGER Revival of musical,Orange Tree," This is the season in which theatres revisit their histories. In the crumbling glory of Wilton’s Music Hall, east London, Fiona Shaw is reprising her wild version of The Waste Land, talking about death in the City, with the aid of Music Hall voices. Hackney Empire has burst into its traditional life with rousing panto. Meanwhile, the Orange Tree is producing The Lady or the Tiger, which had its premiere at the theatre in 1975 and was revived there in 1989. Now it’s back again; I wish it wasn’t. Based on a whimsical 1882 story by Frank Stockton, the show has words by Michael Richmond and Jeremy Paul and music by Nola York, who once sang with the Chantelles and was the first woman to write a complete score for a West End musical. It has a few good mots, a dash of sauce, but hardly any point It features one despotic ruler who follows his subjects’ every wiggle “from sperm to worm”, one reluctantly virgin daughter (“Think of your position”; “I am, I wish it was horizontal”), one drippy suitor and one multipurpose character who flips from role to role by changing his hat. Riona O’Connor has a suitably 70s Lulu-like shout of a voice but does too much gurgling to be really convincing as a grown-up: she sings better than she swings. As the naughty king - ooh what a scamp that tyrant is - Howard Samuels dispenses oeillades, pecks on the cheeks and pats on the knees to the ladies in the front row. Sam Walters’s production is almost eerily pleasant. It’s like a panto that doesn’t yell but quietly chortles.",51.464281,-0.3016356,0,0,3,2,0,2,1,2,1,0,3,Show_Cat,0.021,0.886,0.092,0.9634,0.1273148148148148,0.4597222222222223,0.15,0.37,0.07,0.04,0.37,"[('hall', 0.17117083356912707), ('like', 0.16888300608062487), ('king', 0.16888300608062462), ('sam', 0.16888300608062462), ('land', 0.16888300608062443), ('virgin daughter', 0.15022796317373333), ('oeillades', 0.1422995699383036), ('samuels dispenses', 0.1403058122276301)]",[' This is the season in which theatres revisit their histories'],[' It’s like a panto that doesn’t yell but quietly chortles'],"[' This is the season in which theatres revisit their histories', ' In the crumbling glory of Wilton’s Music Hall, east London, Fiona Shaw is reprising her wild version of The Waste Land, talking about death in the City, with the aid of Music Hall voices']","[' Sam Walters’s production is almost eerily pleasant', ' It’s like a panto that doesn’t yell but quietly chortles']","[' This is the season in which theatres revisit their histories', ' In the crumbling glory of Wilton’s Music Hall, east London, Fiona Shaw is reprising her wild version of The Waste Land, talking about death in the City, with the aid of Music Hall voices', ' Hackney Empire has burst into its traditional life with rousing panto']","[' As the naughty king - ooh what a scamp that tyrant is - Howard Samuels dispenses oeillades, pecks on the cheeks and pats on the knees to the ladies in the front row', ' Sam Walters’s production is almost eerily pleasant', ' It’s like a panto that doesn’t yell but quietly chortles']",12,11,11,46,19,58,53,0,0,0,0,0,0,0,0,0,0,0,0,5.1,4.7,4.64,5.35,4.78,4.46,Susannah,female,"['season', 'theatre', 'revisit', 'history', 'crumbling', 'glory', 'wilton’s', 'music', 'hall', 'east', 'london', 'fiona', 'shaw', 'reprising', 'wild', 'version', 'waste', 'land', 'talking', 'death', 'city', 'aid', 'music', 'hall', 'voice', 'hackney', 'empire', 'burst', 'traditional', 'life', 'rousing', 'panto', 'meanwhile', 'orange', 'tree', 'producing', 'lady', 'tiger', 'premiere', 'theatre', '1975', 'revived', '1989', 'it’s', 'back', 'again', 'wish', 'wasn’t', 'based', 'whimsical', '1882', 'story', 'frank', 'stockton', 'show', 'word', 'michael', 'richmond', 'jeremy', 'paul', 'music', 'nola', 'york', 'sang', 'chantelles', 'first', 'woman', 'write', 'complete', 'score', 'west', 'end', 'musical', 'good', 'mot', 'dash', 'sauce', 'hardly', 'point', 'feature', 'one', 'despotic', 'ruler', 'follows', 'subjects’', 'every', 'wiggle', '“from', 'sperm', 'worm”', 'one', 'reluctantly', 'virgin', 'daughter', '“think', 'position”', '“i', 'am', 'wish', 'horizontal”', 'one', 'drippy', 'suitor', 'one', 'multipurpose', 'character', 'flip', 'role', 'role', 'changing', 'hat', 'riona', 'o’connor', 'suitably', '70', 'lululike', 'shout', 'voice', 'much', 'gurgling', 'really', 'convincing', 'grownup', 'sings', 'better', 'swing', 'naughty', 'king', 'ooh', 'scamp', 'tyrant', 'howard', 'samuel', 'dispenses', 'oeillades', 'peck', 'cheek', 'pat', 'knee', 'lady', 'front', 'row', 'sam', 'walters’s', 'production', 'almost', 'eerily', 'pleasant', 'it’s', 'like', 'panto', 'doesn’t', 'yell', 'quietly', 'chortle']",,
6,TIME OUT LONDON,21.1.10,Lucy Powell ,THE LADY OR THE TIGER Revival of musical,Orange Tree," This pint-sized, panto-inflected musical from Michael Richmond, Jeremy Paul and Nola York was a decided smash for the newly minted Orange Tree in 1975, returning in 1986, when it transferred to the West End. But this warm-hearted revival from Sam Walters proves one too many. Based on an 1882 story by Frank Stockton, an oh-so-lovable dictator devises a novel way to try his criminals. In a vast arena, the accused, who is also the lust object for an extraordinarily frustrated Princess, must choose between two doors. Behind one lies a blushing bride; behind the other, a ferocious, four-legged feline. Death, then, or the maiden. The programme begs us not to divulge the denouement, but in the event there isn’t one, merely a reflection of the musical’s own, crippling internal confusion. Neither the tightening fist of despotism nor the potentially radical revisionism of love are worked through with any drive or direction at all. With a wonderfully throaty, tuneful turn from Riona O’Connor as the panting Princess, and a charmingly blithe King from Howard Samuels, it’s winsomely ridiculous, and seasonally diverting enough. But ultimately, this crealty, meandering musical is fatally lacking in bite.",51.464281,-0.3016356,0,0,1,2,0,0,0,0,2,0,2,Story_Cat,0.105,0.801,0.094,0.3716,0.06085858585858586,0.549025974025974,0.07,0.52,0.07,0.22,0.11,"[('dictator', 0.16742686509975319), ('internal', 0.16742686509975319), ('walters', 0.16742686509975316), ('feline', 0.16742686509975313), ('blithe', 0.1674268650997531), ('radical', 0.167426865099753), ('orange', 0.14893266947469946), ('jeremy', 0.14893266947469938), ('frustrated', 0.14893266947469938)]","[' This pint-sized, panto-inflected musical from Michael Richmond, Jeremy Paul and Nola York was a decided smash for the newly minted Orange Tree in 1975, returning in 1986, when it transferred to the West End']","[' But ultimately, this crealty, meandering musical is fatally lacking in bite']","[' This pint-sized, panto-inflected musical from Michael Richmond, Jeremy Paul and Nola York was a decided smash for the newly minted Orange Tree in 1975, returning in 1986, when it transferred to the West End', ' But this warm-hearted revival from Sam Walters proves one too many']","[' With a wonderfully throaty, tuneful turn from Riona O’Connor as the panting Princess, and a charmingly blithe King from Howard Samuels, it’s winsomely ridiculous, and seasonally diverting enough', ' But ultimately, this crealty, meandering musical is fatally lacking in bite']","[' This pint-sized, panto-inflected musical from Michael Richmond, Jeremy Paul and Nola York was a decided smash for the newly minted Orange Tree in 1975, returning in 1986, when it transferred to the West End', ' But this warm-hearted revival from Sam Walters proves one too many', ' Based on an 1882 story by Frank Stockton, an oh-so-lovable dictator devises a novel way to try his criminals']","[' Neither the tightening fist of despotism nor the potentially radical revisionism of love are worked through with any drive or direction at all', ' With a wonderfully throaty, tuneful turn from Riona O’Connor as the panting Princess, and a charmingly blithe King from Howard Samuels, it’s winsomely ridiculous, and seasonally diverting enough', ' But ultimately, this crealty, meandering musical is fatally lacking in bite']",11,35,12,47,41,67,65,0,0,0,0,0,0,0,0,0,0,0,0,5.09,5.91,5.09,5.95,4.98,5.68,Lucy,female,"['pintsized', 'pantoinflected', 'musical', 'michael', 'richmond', 'jeremy', 'paul', 'nola', 'york', 'decided', 'smash', 'newly', 'minted', 'orange', 'tree', '1975', 'returning', '1986', 'transferred', 'west', 'end', 'warmhearted', 'revival', 'sam', 'walter', 'prof', 'one', 'many', 'based', '1882', 'story', 'frank', 'stockton', 'ohsolovable', 'dictator', 'devise', 'novel', 'way', 'try', 'criminal', 'vast', 'arena', 'accused', 'also', 'lust', 'object', 'extraordinarily', 'frustrated', 'princess', 'must', 'choose', 'two', 'door', 'behind', 'one', 'lie', 'blushing', 'bride', 'behind', 'other', 'ferocious', 'fourlegged', 'feline', 'death', 'then', 'maiden', 'programme', 'begs', 'u', 'divulge', 'denouement', 'event', 'isn’t', 'one', 'merely', 'reflection', 'musical’s', 'own', 'crippling', 'internal', 'confusion', 'neither', 'tightening', 'fist', 'despotism', 'potentially', 'radical', 'revisionism', 'love', 'worked', 'drive', 'direction', 'all', 'wonderfully', 'throaty', 'tuneful', 'turn', 'riona', 'o’connor', 'panting', 'princess', 'charmingly', 'blithe', 'king', 'howard', 'samuel', 'it’s', 'winsomely', 'ridiculous', 'seasonally', 'diverting', 'enough', 'ultimately', 'crealty', 'meandering', 'musical', 'fatally', 'lacking', 'bite']",cluster5,"(4, '0.008*""play"" + 0.007*""production"" + 0.004*""one"" + 0.004*""comedy"" + 0.004*""like"" + 0.003*""stage"" + 0.003*""—"" + 0.003*""shakespeare"" + 0.003*""make"" + 0.003*""actor""')"
7,INDEPENDENT,7.1.10,ZoE Anderson ,VAREKAI Return of show,Royal Albert Hall," Celebrating its 25th anniversary this year, Cirque du Soleil has become the biggest brand in world circus. “Brand” is the word, because there’s something very corporate about this Canadian company’s approach to circus. The performers are spectacular: Varekai includes some astonishing feats, from intricate balancing acts to Russian swings. The framing show is blandly predictable. Creators Guy Laliberty and Dominic Champagne give Varekai a vague narrative about Icarus falling from the sky, meeting and eventually marrying a contortionist bride. This isn’t exactly a story. There’s no fear in Icarus’s fall, however elegantly Mark Halasi dives and swings in his net trapeze. None of these characters will ever get truly scared, or risky. It’s all vague uplift. Cirque du Soleil’s trademark magical creatures waft about, expressing non-specific wonder and amazement. Eiko Ishioka’s costumes and Nathalie Gagnd’s make-up designs are instantly recognisable as Cirque du Soleil style. There are lizard spines, frilly ruffs, all in shiny fabrics and contrasting colours. The make-up is laid on thick, with lurid colours. The performers are turned into types, with little space for individuality. The clowns are predictable, too. Steven Bishop and Mooky Cornish keep popping up as incompetent ushers, an incompetent magic act, incompetent singers. Other clowns babble at the wonders of the sky, or mime elaborate routines to sound effects. Even the circus acts can be muted by the prevailing waffle. Bombastic rock opera singing, vague gestures and heavy costuming take the edge off the slippery surface act. Varekai takes off only when it focuses on the basics of its circus routines, the wonders of balance and control. Dergin Tokmak writhes and pounces across the stage on crutches, loping his way through twisting balances. Octavio Alegria juggles hats, throwing some in boomerang circles as he flips the others from hand to head. He even juggles with his mouth, spitting out ping-pong balls until he seems to be gargling them. In the “Icarian Games”, one performer lies with legs in the air. His partner starts out perched on his feet, then flips over and over, like a human Catherine wheel. Georgian dancers whirl on their knees, stomping and leaping. Irina Naumenko ties herself in impossible knots while balancing on canes. Best of all is the finale, with acrobats leaping from big swings. The extra momentum sends them high into the air, flipping and turning before landing, rock solid, in the catchers’ hands. The jumps and throws get bigger and wilder, men crossing in mid-air, landing in pyramid balances or diving down billowing nets to the ground.",51.5009088,-0.177366,0,1,1,2,0,0,0,4,2,1,4,Character_Cat,0.062,0.872,0.066,0.5574,0.009566993464052294,0.4910457516339869,0.13,0.39,0.03,0.17,0.28,"[('act', 0.19131194044412342), ('balances', 0.17459188874250758), ('vague', 0.1513415774039472), ('varekai', 0.1473276004470702), ('rock', 0.14430159099192572), ('circus', 0.139835899146489), ('incompetent', 0.13511401892959024), ('magic', 0.1340279073527332), ('air', 0.1221072644783858), ('men', 0.1107049527299793)]","[' Celebrating its 25th anniversary this year, Cirque du Soleil has become the biggest brand in world circus']","[' The jumps and throws get bigger and wilder, men crossing in mid-air, landing in pyramid balances or diving down billowing nets to the ground']","[' Celebrating its 25th anniversary this year, Cirque du Soleil has become the biggest brand in world circus', ' “Brand” is the word, because there’s something very corporate about this Canadian company’s approach to circus']","[' The extra momentum sends them high into the air, flipping and turning before landing, rock solid, in the catchers’ hands', ' The jumps and throws get bigger and wilder, men crossing in mid-air, landing in pyramid balances or diving down billowing nets to the ground']","[' Celebrating its 25th anniversary this year, Cirque du Soleil has become the biggest brand in world circus', ' “Brand” is the word, because there’s something very corporate about this Canadian company’s approach to circus', ' The performers are spectacular: Varekai includes some astonishing feats, from intricate balancing acts to Russian swings']","[' Best of all is the finale, with acrobats leaping from big swings', ' The extra momentum sends them high into the air, flipping and turning before landing, rock solid, in the catchers’ hands', ' The jumps and throws get bigger and wilder, men crossing in mid-air, landing in pyramid balances or diving down billowing nets to the ground']",31,18,25,35,46,52,59,0,0,0,0,0,0,0,0,0,0,0,0,5.24,4.88,5.58,4.95,5.9,4.84,ZoE,unknown,"['celebrating', '25th', 'anniversary', 'year', 'cirque', 'du', 'soleil', 'become', 'biggest', 'brand', 'world', 'circus', '“brand”', 'word', 'there’s', 'something', 'corporate', 'canadian', 'company’s', 'approach', 'circus', 'performer', 'spectacular', 'varekai', 'includes', 'astonishing', 'feat', 'intricate', 'balancing', 'act', 'russian', 'swing', 'framing', 'show', 'blandly', 'predictable', 'creator', 'guy', 'laliberty', 'dominic', 'champagne', 'give', 'varekai', 'vague', 'narrative', 'icarus', 'falling', 'sky', 'meeting', 'eventually', 'marrying', 'contortionist', 'bride', 'isn’t', 'exactly', 'story', 'there’s', 'fear', 'icarus’s', 'fall', 'however', 'elegantly', 'mark', 'halasi', 'dive', 'swing', 'net', 'trapeze', 'none', 'character', 'ever', 'get', 'truly', 'scared', 'risky', 'it’s', 'vague', 'uplift', 'cirque', 'du', 'soleil’s', 'trademark', 'magical', 'creature', 'waft', 'about', 'expressing', 'nonspecific', 'wonder', 'amazement', 'eiko', 'ishioka’s', 'costume', 'nathalie', 'gagnd’s', 'makeup', 'design', 'instantly', 'recognisable', 'cirque', 'du', 'soleil', 'style', 'lizard', 'spine', 'frilly', 'ruff', 'shiny', 'fabric', 'contrasting', 'colour', 'makeup', 'laid', 'thick', 'lurid', 'colour', 'performer', 'turned', 'type', 'little', 'space', 'individuality', 'clown', 'predictable', 'too', 'steven', 'bishop', 'mooky', 'cornish', 'keep', 'popping', 'incompetent', 'usher', 'incompetent', 'magic', 'act', 'incompetent', 'singer', 'clown', 'babble', 'wonder', 'sky', 'mime', 'elaborate', 'routine', 'sound', 'effect', 'even', 'circus', 'act', 'muted', 'prevailing', 'waffle', 'bombastic', 'rock', 'opera', 'singing', 'vague', 'gesture', 'heavy', 'costuming', 'take', 'edge', 'slippery', 'surface', 'act', 'varekai', 'take', 'focus', 'basic', 'circus', 'routine', 'wonder', 'balance', 'control', 'dergin', 'tokmak', 'writhes', 'pounce', 'across', 'stage', 'crutch', 'loping', 'way', 'twisting', 'balance', 'octavio', 'alegria', 'juggle', 'hat', 'throwing', 'boomerang', 'circle', 'flip', 'others', 'hand', 'head', 'even', 'juggle', 'mouth', 'spitting', 'pingpong', 'ball', 'seems', 'gargling', 'them', '“icarian', 'games”', 'one', 'performer', 'lie', 'leg', 'air', 'partner', 'start', 'perched', 'foot', 'flip', 'over', 'like', 'human', 'catherine', 'wheel', 'georgian', 'dancer', 'whirl', 'knee', 'stomping', 'leaping', 'irina', 'naumenko', 'tie', 'impossible', 'knot', 'balancing', 'cane', 'best', 'finale', 'acrobat', 'leaping', 'big', 'swing', 'extra', 'momentum', 'sends', 'high', 'air', 'flipping', 'turning', 'landing', 'rock', 'solid', 'catchers’', 'hand', 'jump', 'throw', 'get', 'bigger', 'wilder', 'men', 'crossing', 'midair', 'landing', 'pyramid', 'balance', 'diving', 'billowing', 'net', 'ground']",,
